<?xml version="1.0" encoding="UTF-8"?>
<?xml-stylesheet type="text/xsl" href="fortresses.xsl"?>

<catalog xmlns:xsi="http://www.w3.org/2001/XMLSchema-instance"
         xsi:noNamespaceSchemaLocation="fortresses.xsd">
    
    <!-- Региони -->
    <regions>
        <region id="BG31" name="Северозападен регион"/>
        <region id="BG32" name="Северен централен регион"/>
        <region id="BG33" name="Североизточен регион"/>
        <region id="BG34" name="Югоизточен регион"/>
        <region id="BG41" name="Югозападен регион"/>
        <region id="BG42" name="Южен централен регион"/>
    </regions>

    <!-- Области -->
    <areas>
        <area id="BG311" regionRef="BG31"><name>Видин</name></area>
        <area id="BG312" regionRef="BG31"><name>Монтана</name></area>
        <area id="BG313" regionRef="BG31"><name>Враца</name></area>
        <area id="BG314" regionRef="BG31"><name>Плевен</name></area>
        <area id="BG315" regionRef="BG31"><name>Ловеч</name></area>
        <area id="BG321" regionRef="BG32"><name>Велико Търново</name></area>
        <area id="BG322" regionRef="BG32"><name>Габрово</name></area>
        <area id="BG323" regionRef="BG32"><name>Русе</name></area>
        <area id="BG324" regionRef="BG32"><name>Разград</name></area>
        <area id="BG325" regionRef="BG32"><name>Силистра</name></area>
        <area id="BG331" regionRef="BG33"><name>Варна</name></area>
        <area id="BG332" regionRef="BG33"><name>Добрич</name></area>
        <area id="BG333" regionRef="BG33"><name>Шумен</name></area>
        <area id="BG334" regionRef="BG33"><name>Търговище</name></area>
        <area id="BG341" regionRef="BG34"><name>Бургас</name></area>
        <area id="BG342" regionRef="BG34"><name>Сливен</name></area>
        <area id="BG343" regionRef="BG34"><name>Ямбол</name></area>
        <area id="BG344" regionRef="BG34"><name>Стара Загора</name></area>
        <area id="BG411" regionRef="BG41"><name>София-град</name></area>
        <area id="BG412" regionRef="BG41"><name>Софийска област</name></area>
        <area id="BG413" regionRef="BG41"><name>Благоевград</name></area>
        <area id="BG414" regionRef="BG41"><name>Перник</name></area>
        <area id="BG415" regionRef="BG41"><name>Кюстендил</name></area>
        <area id="BG421" regionRef="BG42"><name>Пловдив</name></area>
        <area id="BG422" regionRef="BG42"><name>Хасково</name></area>
        <area id="BG423" regionRef="BG42"><name>Пазарджик</name></area>
        <area id="BG424" regionRef="BG42"><name>Смолян</name></area>
        <area id="BG425" regionRef="BG42"><name>Кърджали</name></area>
    </areas>
    
    <!-- Каталог на крепости -->
    <fortresses>
        <!-- Царевец -->
        <fortress id="f001">
            <name>Царевец</name>
            <type>Българска</type>
            <subtype>Царска крепост</subtype>
            <location>
                <areaRef>BG321</areaRef>
                <city>Велико Търново</city>
                <region>Северен централен регион</region>
                <coordinates>
                    <latitude>43.0814</latitude>
                    <longitude>25.6519</longitude>
                </coordinates>
            </location>
            <period>
                <built-era>Византийска епоха (V-VII век)</built-era>
                <main-use>Второ българско царство (XII-XIV век)</main-use>
            </period>
            <preservation-status>Частично възстановена</preservation-status>
            <description>
                Царевец е средновековна крепост в Велико Търново, столица на Второто българско царство. Крепостта се намира на едноименния хълм и е била резиденция на българските царе и патриарси. Запазени са крепостните стени, порти и патриаршеската църква. Днес е музей под открито небе и символ на българската история.
            </description>
            <features>
                <feature>Патриаршеска църква</feature>
                <feature>Царски дворец</feature>
                <feature>Крепостни стени с височина до 10 метра</feature>
                <feature>Балдуинова кула</feature>
            </features>
            <visitor-info>
                <entrance-fee>
                    <amount currency="BGN">6.00</amount>
                    <amount currency="EUR">3.07</amount>
                </entrance-fee>
                <working-hours>09:00-18:00</working-hours>
            </visitor-info>
            <image>tsarevets.jpg</image>
        </fortress>
        
        <!-- Баба Вида -->
        <fortress id="f002">
            <name>Баба Вида</name>
            <type>Българска</type>
            <subtype>Дунавска крепост</subtype>
            <location>
                <areaRef>BG311</areaRef>
                <city>Видин</city>
                <region>Северозападен регион</region>
                <coordinates>
                    <latitude>43.9909</latitude>
                    <longitude>22.8711</longitude>
                </coordinates>
            </location>
            <period>
                <built-era>X-XIV век</built-era>
                <main-use>Средновековна България</main-use>
            </period>
            <preservation-status>Отлично запазена</preservation-status>
            <description>
                Баба Вида е единствената напълно запазена средновековна крепост в България. Разположена на брега на река Дунав във Видин, крепостта е построена върху основите на римската крепост Бононя. Името й произлиза от легендата за владетелката Вида. Крепостта е с два концентрични реда крепостни стени и четири кули.
            </description>
            <features>
                <feature>Два реда крепостни стени</feature>
                <feature>Четири бойни кули</feature>
                <feature>Водна защита от Дунав</feature>
                <feature>Средновековен мост</feature>
            </features>
            <visitor-info>
                <entrance-fee>
                    <amount currency="BGN">4.00</amount>
                    <amount currency="EUR">2.05</amount>
                </entrance-fee>
                <working-hours>09:00-17:00</working-hours>
            </visitor-info>
            <image>baba-vida.jpg</image>
        </fortress>
        
        <!-- Асенова крепост -->
        <fortress id="f003">
            <name>Асенова крепост</name>
            <type>Византийска</type>
            <subtype>Планинска крепост</subtype>
            <location>
                <areaRef>BG421</areaRef>
                <city>Асеновград</city>
                <region>Южен централен регион</region>
                <coordinates>
                    <latitude>41.9831</latitude>
                    <longitude>24.8731</longitude>
                </coordinates>
            </location>
            <period>
                <built-era>Византийска епоха (XI век)</built-era>
                <main-use>Средновековна България (XIII-XIV век)</main-use>
            </period>
            <preservation-status>Частично запазена</preservation-status>
            <description>
                Асенова крепост е средновековна крепост в Родопите, известна още като Асеновата крепост. Разположена е на скалист рид край Асеновград. Възстановена е от цар Иван Асен II през XIII век. Най-забележителен е запазената църква "Света Богородица Петричка" с ценни стенописи от XIII-XIV век.
            </description>
            <features>
                <feature>Църква "Света Богородица Петричка"</feature>
                <feature>Средновековни стенописи</feature>
                <feature>Крепостни кули</feature>
                <feature>Скално укрепление</feature>
            </features>
            <visitor-info>
                <entrance-fee>
                    <amount currency="BGN">3.00</amount>
                    <amount currency="EUR">1.53</amount>
                </entrance-fee>
                <working-hours>08:30-17:30</working-hours>
            </visitor-info>
            <image>asenova.jpg</image>
        </fortress>
        
        <!-- Белоградчишка крепост -->
        <fortress id="f004">
            <name>Белоградчишка крепост</name>
            <type>Римска</type>
            <subtype>Скална крепост</subtype>
            <location>
                <areaRef>BG311</areaRef>
                <city>Белоградчик</city>
                <region>Северозападен регион</region>
                <coordinates>
                    <latitude>43.6272</latitude>
                    <longitude>22.6850</longitude>
                </coordinates>
            </location>
            <period>
                <built-era>Римска епоха (I-III век)</built-era>
                <main-use>Средновековна България (XIV век)</main-use>
            </period>
            <preservation-status>Добре запазена</preservation-status>
            <description>
                Белоградчишката крепост е разположена сред Белоградчишките скали и е един от най-добре запазените паметници на крепостното строителство в България. Построена е върху римска основа и е развивана през византийската и българската епохи. Крепостта е естествено защитена от скалните образувания.
            </description>
            <features>
                <feature>Три крепостни двора</feature>
                <feature>Естествена скална защита</feature>
                <feature>Римски основи</feature>
                <feature>Наблюдателни кули</feature>
            </features>
            <visitor-info>
                <entrance-fee>
                    <amount currency="BGN">5.00</amount>
                    <amount currency="EUR">2.56</amount>
                </entrance-fee>
                <working-hours>09:00-18:00</working-hours>
            </visitor-info>
            <image>belogradchick.jpg</image>
        </fortress>